{
  "profile_id": "secretary.conversation",
  "version": "0.2.0",
  "canonical_resolution": "R1",
  "allow_unspecified": false,
  "required_backbone_paths": ["/direction", "/text"],
  "fields": [
    {
      "path": "/direction",
      "introduced_at": "R0",
      "write_min_resolution": "R1",
      "downgrade_policy": "READ_ONLY_WHEN_PROJECTED",
      "cable_id": "INPUT",
      "semantic_contract_id": "secretary.conversation.direction.v1",
      "data_class": "INTERNAL",
      "expected_type": "string",
      "required_for_actions": []
    },
    {
      "path": "/text",
      "introduced_at": "R0",
      "write_min_resolution": "R1",
      "downgrade_policy": "READ_ONLY_WHEN_PROJECTED",
      "cable_id": "INPUT",
      "semantic_contract_id": "secretary.conversation.text.v1",
      "data_class": "INTERNAL",
      "expected_type": "string",
      "required_for_actions": ["DRAFT_REPLY"]
    },
    {
      "path": "/channel",
      "introduced_at": "R1",
      "write_min_resolution": "R1",
      "downgrade_policy": "READ_ONLY_WHEN_PROJECTED",
      "cable_id": "INPUT",
      "semantic_contract_id": "secretary.conversation.transport.v1",
      "data_class": "INTERNAL",
      "expected_type": "string",
      "required_for_actions": []
    },
    {
      "path": "/brain_provider",
      "introduced_at": "R1",
      "write_min_resolution": "R1",
      "downgrade_policy": "READ_ONLY_WHEN_PROJECTED",
      "cable_id": "AUDIT",
      "semantic_contract_id": "secretary.conversation.brain-provider.v1",
      "data_class": "INTERNAL",
      "expected_type": null,
      "required_for_actions": []
    },
    {
      "path": "/created_at",
      "introduced_at": "R1",
      "write_min_resolution": "R1",
      "downgrade_policy": "READ_ONLY_WHEN_PROJECTED",
      "cable_id": "EVENT",
      "semantic_contract_id": "world-v6.time.occurred-at.v1",
      "data_class": "INTERNAL",
      "expected_type": "string",
      "required_for_actions": []
    },
    {
      "path": "/message_id",
      "introduced_at": "R1",
      "write_min_resolution": "R1",
      "downgrade_policy": "READ_ONLY_WHEN_PROJECTED",
      "cable_id": "IDENTITY",
      "semantic_contract_id": "secretary.conversation.message-id.v1",
      "data_class": "INTERNAL",
      "expected_type": "string",
      "required_for_actions": []
    }
  ],
  "actions": [
    {
      "action": "DRAFT_REPLY",
      "minimum_resolution": "R0",
      "required_paths": ["/direction", "/text"]
    }
  ]
}
