{
  "profile_id": "secretary.task",
  "version": "0.2.0",
  "canonical_resolution": "R1",
  "allow_unspecified": false,
  "required_backbone_paths": ["/task_id", "/title", "/status", "/next_action"],
  "fields": [
    {
      "path": "/task_id",
      "introduced_at": "R0",
      "write_min_resolution": "R1",
      "downgrade_policy": "READ_ONLY_WHEN_PROJECTED",
      "cable_id": "TASK_COMMAND",
      "semantic_contract_id": "secretary.task.id.v1",
      "data_class": "INTERNAL",
      "expected_type": "string",
      "required_for_actions": []
    },
    {
      "path": "/title",
      "introduced_at": "R0",
      "write_min_resolution": "R0",
      "downgrade_policy": "SAFE_TO_PROJECT",
      "cable_id": "TASK_COMMAND",
      "semantic_contract_id": "secretary.task.title.v1",
      "data_class": "INTERNAL",
      "expected_type": "string",
      "required_for_actions": ["ADD_TASK"]
    },
    {
      "path": "/status",
      "introduced_at": "R0",
      "write_min_resolution": "R0",
      "downgrade_policy": "SAFE_TO_PROJECT",
      "cable_id": "TASK_COMMAND",
      "semantic_contract_id": "secretary.task.status.v1",
      "data_class": "INTERNAL",
      "expected_type": "string",
      "required_for_actions": []
    },
    {
      "path": "/next_action",
      "introduced_at": "R0",
      "write_min_resolution": "R0",
      "downgrade_policy": "SAFE_TO_PROJECT",
      "cable_id": "TASK_COMMAND",
      "semantic_contract_id": "secretary.task.next-action.v1",
      "data_class": "INTERNAL",
      "expected_type": null,
      "required_for_actions": []
    },
    {
      "path": "/due_at",
      "introduced_at": "R1",
      "write_min_resolution": "R1",
      "downgrade_policy": "SAFE_TO_PROJECT",
      "cable_id": "TASK_COMMAND",
      "semantic_contract_id": "secretary.task.due-at.v1",
      "data_class": "INTERNAL",
      "expected_type": null,
      "required_for_actions": []
    },
    {
      "path": "/priority",
      "introduced_at": "R1",
      "write_min_resolution": "R1",
      "downgrade_policy": "SAFE_TO_PROJECT",
      "cable_id": "TASK_COMMAND",
      "semantic_contract_id": "secretary.task.priority.v1",
      "data_class": "INTERNAL",
      "expected_type": "string",
      "required_for_actions": []
    },
    {
      "path": "/domain",
      "introduced_at": "R1",
      "write_min_resolution": "R1",
      "downgrade_policy": "SAFE_TO_PROJECT",
      "cable_id": "TASK_COMMAND",
      "semantic_contract_id": "secretary.task.domain.v1",
      "data_class": "INTERNAL",
      "expected_type": "string",
      "required_for_actions": []
    },
    {
      "path": "/goal_id",
      "introduced_at": "R1",
      "write_min_resolution": "R1",
      "downgrade_policy": "SAFE_TO_PROJECT",
      "cable_id": "TASK_COMMAND",
      "semantic_contract_id": "secretary.task.goal-id.v1",
      "data_class": "INTERNAL",
      "expected_type": null,
      "required_for_actions": []
    },
    {
      "path": "/created_at",
      "introduced_at": "R1",
      "write_min_resolution": "R1",
      "downgrade_policy": "READ_ONLY_WHEN_PROJECTED",
      "cable_id": "EVENT",
      "semantic_contract_id": "world-v6.time.created-at.v1",
      "data_class": "INTERNAL",
      "expected_type": "string",
      "required_for_actions": []
    }
  ],
  "actions": [
    {
      "action": "ADD_TASK",
      "minimum_resolution": "R0",
      "required_paths": ["/title"]
    },
    {
      "action": "UPDATE_TASK_DETAIL",
      "minimum_resolution": "R1",
      "required_paths": ["/task_id", "/domain", "/priority"]
    }
  ]
}
