{
  "profile_id": "secretary.price",
  "version": "0.2.0",
  "canonical_resolution": "R1",
  "allow_unspecified": false,
  "required_backbone_paths": ["/customer_id", "/product_key", "/unit", "/active"],
  "fields": [
    {
      "path": "/customer_id",
      "introduced_at": "R0",
      "write_min_resolution": "R1",
      "downgrade_policy": "READ_ONLY_WHEN_PROJECTED",
      "cable_id": "IDENTITY",
      "semantic_contract_id": "secretary.price.customer-id.v1",
      "data_class": "CONFIDENTIAL",
      "expected_type": "string",
      "required_for_actions": []
    },
    {
      "path": "/product_key",
      "introduced_at": "R0",
      "write_min_resolution": "R1",
      "downgrade_policy": "READ_ONLY_WHEN_PROJECTED",
      "cable_id": "IDENTITY",
      "semantic_contract_id": "secretary.price.product-key.v1",
      "data_class": "CONFIDENTIAL",
      "expected_type": "string",
      "required_for_actions": []
    },
    {
      "path": "/unit",
      "introduced_at": "R0",
      "write_min_resolution": "R1",
      "downgrade_policy": "READ_ONLY_WHEN_PROJECTED",
      "cable_id": "IDENTITY",
      "semantic_contract_id": "secretary.price.unit.v1",
      "data_class": "CONFIDENTIAL",
      "expected_type": "string",
      "required_for_actions": []
    },
    {
      "path": "/active",
      "introduced_at": "R0",
      "write_min_resolution": "R1",
      "downgrade_policy": "READ_ONLY_WHEN_PROJECTED",
      "cable_id": "STATE_MEMORY",
      "semantic_contract_id": "secretary.price.active.v1",
      "data_class": "CONFIDENTIAL",
      "expected_type": "boolean",
      "required_for_actions": []
    },
    {
      "path": "/unit_price_irr",
      "introduced_at": "R1",
      "write_min_resolution": "R1",
      "downgrade_policy": "NO_DOWNGRADE",
      "cable_id": "ACTION",
      "semantic_contract_id": "secretary.price.exact-irr-decimal-string.v1",
      "data_class": "CONFIDENTIAL",
      "expected_type": "string",
      "required_for_actions": ["BUILD_PROFORMA_DRAFT", "PRICE_LOOKUP"]
    },
    {
      "path": "/valid_until",
      "introduced_at": "R1",
      "write_min_resolution": "R1",
      "downgrade_policy": "NO_DOWNGRADE",
      "cable_id": "POLICY",
      "semantic_contract_id": "secretary.price.valid-until.v1",
      "data_class": "CONFIDENTIAL",
      "expected_type": null,
      "required_for_actions": ["BUILD_PROFORMA_DRAFT"]
    },
    {
      "path": "/approved_by",
      "introduced_at": "R1",
      "write_min_resolution": "R1",
      "downgrade_policy": "NO_DOWNGRADE",
      "cable_id": "APPROVAL",
      "semantic_contract_id": "world-v6.approval.approver-ref.v1",
      "data_class": "CONFIDENTIAL",
      "expected_type": "string",
      "required_for_actions": ["BUILD_PROFORMA_DRAFT"]
    },
    {
      "path": "/approved_at",
      "introduced_at": "R1",
      "write_min_resolution": "R1",
      "downgrade_policy": "NO_DOWNGRADE",
      "cable_id": "APPROVAL",
      "semantic_contract_id": "world-v6.approval.issued-at.v1",
      "data_class": "CONFIDENTIAL",
      "expected_type": "string",
      "required_for_actions": ["BUILD_PROFORMA_DRAFT"]
    }
  ],
  "actions": [
    {
      "action": "PRICE_LOOKUP",
      "minimum_resolution": "R1",
      "required_paths": ["/customer_id", "/product_key", "/unit", "/unit_price_irr"]
    },
    {
      "action": "BUILD_PROFORMA_DRAFT",
      "minimum_resolution": "R1",
      "required_paths": ["/customer_id", "/product_key", "/unit", "/unit_price_irr", "/valid_until", "/approved_by", "/approved_at"]
    }
  ]
}
