{
  "profile_id": "secretary.external-effect",
  "version": "0.2.0",
  "canonical_resolution": "R1",
  "allow_unspecified": false,
  "required_backbone_paths": ["/command_id", "/destination", "/action", "/resource_ref"],
  "fields": [
    {
      "path": "/command_id",
      "introduced_at": "R0",
      "write_min_resolution": "R1",
      "downgrade_policy": "READ_ONLY_WHEN_PROJECTED",
      "cable_id": "TASK_COMMAND",
      "semantic_contract_id": "world-v6.command.id.v1",
      "data_class": "RESTRICTED",
      "expected_type": "string",
      "required_for_actions": []
    },
    {
      "path": "/destination",
      "introduced_at": "R0",
      "write_min_resolution": "R1",
      "downgrade_policy": "READ_ONLY_WHEN_PROJECTED",
      "cable_id": "ACTION",
      "semantic_contract_id": "world-v6.effect.destination.v1",
      "data_class": "RESTRICTED",
      "expected_type": "string",
      "required_for_actions": []
    },
    {
      "path": "/action",
      "introduced_at": "R0",
      "write_min_resolution": "R1",
      "downgrade_policy": "READ_ONLY_WHEN_PROJECTED",
      "cable_id": "ACTION",
      "semantic_contract_id": "world-v6.effect.action.v1",
      "data_class": "RESTRICTED",
      "expected_type": "string",
      "required_for_actions": []
    },
    {
      "path": "/resource_ref",
      "introduced_at": "R0",
      "write_min_resolution": "R1",
      "downgrade_policy": "READ_ONLY_WHEN_PROJECTED",
      "cable_id": "ACTION",
      "semantic_contract_id": "world-v6.effect.resource-ref.v1",
      "data_class": "RESTRICTED",
      "expected_type": "string",
      "required_for_actions": []
    },
    {
      "path": "/recipient_ref",
      "introduced_at": "R1",
      "write_min_resolution": "R1",
      "downgrade_policy": "NO_DOWNGRADE",
      "cable_id": "ACTION",
      "semantic_contract_id": "world-v6.effect.recipient-ref.v1",
      "data_class": "RESTRICTED",
      "expected_type": "string",
      "required_for_actions": ["EXECUTE_EXTERNAL"]
    },
    {
      "path": "/payload_hash",
      "introduced_at": "R1",
      "write_min_resolution": "R1",
      "downgrade_policy": "NO_DOWNGRADE",
      "cable_id": "ACTION",
      "semantic_contract_id": "world-v6.effect.payload-hash.v1",
      "data_class": "RESTRICTED",
      "expected_type": "string",
      "required_for_actions": ["EXECUTE_EXTERNAL"]
    },
    {
      "path": "/effect_hash",
      "introduced_at": "R1",
      "write_min_resolution": "R1",
      "downgrade_policy": "NO_DOWNGRADE",
      "cable_id": "APPROVAL",
      "semantic_contract_id": "world-v6.effect.effect-hash.v1",
      "data_class": "RESTRICTED",
      "expected_type": "string",
      "required_for_actions": ["EXECUTE_EXTERNAL"]
    },
    {
      "path": "/approval_ref",
      "introduced_at": "R1",
      "write_min_resolution": "R1",
      "downgrade_policy": "NO_DOWNGRADE",
      "cable_id": "APPROVAL",
      "semantic_contract_id": "world-v6.approval.ref.v1",
      "data_class": "RESTRICTED",
      "expected_type": "string",
      "required_for_actions": ["EXECUTE_EXTERNAL"]
    },
    {
      "path": "/policy_decision_ref",
      "introduced_at": "R1",
      "write_min_resolution": "R1",
      "downgrade_policy": "NO_DOWNGRADE",
      "cable_id": "POLICY",
      "semantic_contract_id": "world-v6.policy.decision-ref.v1",
      "data_class": "RESTRICTED",
      "expected_type": "string",
      "required_for_actions": ["EXECUTE_EXTERNAL"]
    },
    {
      "path": "/control_epoch",
      "introduced_at": "R1",
      "write_min_resolution": "R1",
      "downgrade_policy": "NO_DOWNGRADE",
      "cable_id": "POLICY",
      "semantic_contract_id": "world-v6.control-epoch.v1",
      "data_class": "RESTRICTED",
      "expected_type": "integer",
      "required_for_actions": ["EXECUTE_EXTERNAL"]
    },
    {
      "path": "/expected_version",
      "introduced_at": "R1",
      "write_min_resolution": "R1",
      "downgrade_policy": "NO_DOWNGRADE",
      "cable_id": "STATE_MEMORY",
      "semantic_contract_id": "world-v6.expected-version.v1",
      "data_class": "RESTRICTED",
      "expected_type": "integer",
      "required_for_actions": ["EXECUTE_EXTERNAL"]
    }
  ],
  "actions": [
    {
      "action": "EXECUTE_EXTERNAL",
      "minimum_resolution": "R1",
      "required_paths": ["/command_id", "/destination", "/action", "/resource_ref", "/recipient_ref", "/payload_hash", "/effect_hash", "/approval_ref", "/policy_decision_ref", "/control_epoch", "/expected_version"]
    }
  ]
}
